{
  "schema": "gluerun.orchestration.audit-verdict.v0",
  "taskId": "TASK-0094",
  "runId": "RUN-20260712T203946Z-72285",
  "branch": "agent/graph/TASK-0094-wire-context-mappers",
  "verdict": "accepted",
  "evidenceReviewed": [
    "packet.json (PKT-TASK-0094-l2-72285): status needs-review, baseRef f58b7e7, headSha 2f254129, ownedFiles==changedFiles (3 files)",
    "gate-check.json: cmd 'bash tests/run.sh' exitCode 0",
    "gate-check.log: 114 PASS / 0 FAIL; test-ctx-graph.sh, test-ctx-graph-rebuild.sh, test-ctx-graph-sync.sh, test-ctx-graph-project-context.sh all PASS",
    "worker-evidence/red.log: 'FAIL: rebuilt corpus has no assumption node (context mapper not wired into rebuild)'",
    "worker-evidence/green.log: 'test-ctx-graph: all assertions passed'",
    "worker-evidence/regression.log: SUMMARY 114 passed, 0 failed",
    "git diff f58b7e7..2f254129 --name-status: M on engine/ctx-graph-rebuild.sh, engine/ctx-graph-sync.sh, tests/test-ctx-graph.sh only",
    "engine/ctx-graph-project-context.sh: defines gluerun_graph_project_assumptions (L53) and gluerun_graph_project_capsules (L127)",
    "cli/gluerun L318-321: live path globs and sources all engine/ctx-graph*.sh, so both mappers are defined and guarded calls run live",
    "tests/test-ctx-graph-rebuild.sh L31-77: isolated harness sources only a mapper subset (no context module), motivating the declare -F guard"
  ],
  "commandsRun": [
    "git rev-parse HEAD / --abbrev-ref HEAD",
    "git diff --stat / --name-status f58b7e7..2f254129",
    "cat packet.json, gate-check.json, gate-check.log, worker-evidence/*.log",
    "git diff f58b7e7..2f254129 -- engine/ctx-graph-rebuild.sh engine/ctx-graph-sync.sh tests/test-ctx-graph.sh",
    "grep for gluerun_graph_project_assumptions/_capsules defs and loader wiring across engine/ cli/ tests/",
    "grep -cE '^PASS'/'^FAIL' and graph-test lines in gate-check.log"
  ],
  "findings": [
    "Scope compliant: changedFiles exactly equal ownedFiles (engine/ctx-graph-rebuild.sh, engine/ctx-graph-sync.sh, tests/test-ctx-graph.sh); no forbidden file touched; the two out-of-scope isolated harnesses (test-ctx-graph-rebuild.sh/-sync.sh) were NOT modified.",
    "Test-first evidence valid: RED log message matches the exact newly-added assertion string ('...context mapper not wired into rebuild') and was captured before impl (exit 1); GREEN after (exit 0).",
    "Wiring is genuinely live, not dead code masked by the guard: cli/gluerun sources all ctx-graph*.sh via glob (L318), so gluerun_graph_project_assumptions/_capsules are defined in production; the declare -F guard passes and the mappers run. The guard's only practical effect is letting the subset-sourcing isolated unit harnesses degrade gracefully and stay green without editing them.",
    "sync==rebuild equivalence preserved: identical guarded blocks added to both engine files; owned test asserts diff -q byte-equality of nodes.jsonl/edges.jsonl from scratch AND that assumption+capsule families survive into the sync corpus \u2014 passed.",
    "Provenance/evidence-class invariant upheld: new assumption and capsule nodes are asserted per-node to be evidenceClass 'claim' (never authoritative), consistent with the graph's evidence partitioning.",
    "Gate green with no skips: authoritative full suite = 114 passed, 0 failed, exit 0; all four graph tests plus the TASK-0092 dependency test (test-ctx-graph-project-context.sh) PASS.",
    "Low-severity observation (not blocking): the declare -F guard silently skips the mappers if the context module is ever dropped from the loader glob, with no error signal; acceptable given it is graceful-degradation-by-design, documented in code comments and the packet, and the CLI glob currently guarantees loading."
  ],
  "requiredFixes": [],
  "rationale": "All acceptance conditions are met with evidence. The committed diff (baseRef f58b7e7 -> headSha 2f254129) stays strictly within the three owned files and touches no forbidden file. Strict-test-first is demonstrated: the RED log matches the added assertion and precedes impl; GREEN confirms it. The context-family mappers are wired identically into gluerun_graph_rebuild and gluerun_graph_sync, and the sync==rebuild byte-equivalence is preserved and asserted. The declare -F guard was verified to be a legitimate scope-preserving mechanism \u2014 the live cli/gluerun path glob-sources all ctx-graph*.sh so the mappers actually execute, while the out-of-scope isolated harnesses that intentionally source a subset stay green without modification. The authoritative gate run is exit 0 with 114 passed / 0 failed and no skips. No missing tests, no hidden scope expansion, no branch drift, no foundation violations. Accepted.",
  "findingsStatus": {}
}
