{
  "schema": "gluerun.orchestration.audit-verdict.v0",
  "taskId": "TASK-0102",
  "runId": "RUN-20260712T234435Z-35521",
  "branch": "agent/graph/TASK-0102-subgraph-packet",
  "verdict": "accepted",
  "evidenceReviewed": [
    "packet.json (status needs-review; baseRef bf5e163 == parent of HEAD 54d8efc; headSha and branch match actual git state)",
    "gate-check.json (exitCode 0)",
    "worker-evidence/red.log (strict-test-first RED: impl absent, EXIT=1)",
    "worker-evidence/green.log (all assertions passed, EXIT=0)",
    "worker-evidence/regression.log (packet + engine-clean pass, EXIT=0)",
    "scope-check.log (2 changed paths, all allowed)",
    "secret-scan.log (clean)",
    "worker-packet-validation.log (ok)",
    "git show --stat HEAD (only engine/ctx-rehydrate-subgraph-packet.sh + tests/test-ctx-rehydrate-subgraph-packet.sh; 531 insertions, 0 deletions)",
    "engine/ctx-rehydrate-subgraph-packet.sh (defines functions only; order-preserving renderer, quarantine filter via gluerun_ctx_artifact_exclude, composed assemble; pure read)",
    "tests/test-ctx-rehydrate-subgraph-packet.sh (9 cases: order, per-node non-dedup, manifest schema+sha256, caps, quarantine, fail-safe, determinism, composed assemble, purity/taint)",
    "schemas/orchestration/ctx-rehydrate-manifest.v0.schema.json (manifest output conforms to shipped core schema)",
    "engine/lib.sh loader (auto-sources engine/ctx-*.sh in sorted order)",
    "dependency defs: gluerun_ctx_artifact_exclude, gluerun_ctx_rehydrate_subgraph_select, gluerun_ctx_rehydrate_subgraph_sources"
  ],
  "commandsRun": [
    "git branch --show-current; git log --oneline -5; git status --porcelain; git merge-base HEAD main",
    "git show --stat HEAD; git diff --stat main...HEAD",
    "ls -la .gluerun-state/runs/RUN-20260712T234435Z-35521 and worker-evidence",
    "cat red.log green.log regression.log gate-check.log scope-check.log secret-scan.log worker-packet-validation.log module-packet-guard.log",
    "grep -nE loader-glob engine/lib.sh; grep dep function defs in engine/ctx-artifact-exclude.sh, ctx-rehydrate-subgraph.sh, ctx-rehydrate-subgraph-sources.sh",
    "bash tests/test-ctx-rehydrate-subgraph-packet.sh (GREEN_EXIT=0)",
    "bash tests/test-ctx-rehydrate-subgraph-packet.sh && bash tests/test-engine-clean.sh (REGRESSION_EXIT=0)"
  ],
  "findings": [
    "Committed diff is confined to the two owned files (engine/ctx-rehydrate-subgraph-packet.sh, tests/test-ctx-rehydrate-subgraph-packet.sh); no forbidden file touched; the large main...HEAD diff is only prior integration history since merge-base df4d35d, not this worker's commit.",
    "Strict test-first honored: RED fails closed on absent impl (EXIT=1), GREEN and regression pass (EXIT=0); gate-check exitCode 0 and independently reproduced.",
    "New file DEFINES functions only and is present-but-uncalled (OFF-parity); the OFF-parity case asserts sourcing invokes nothing and writes nothing; render path is pure read (no writes/events/taint mutation) and case9 confirms the rehydrate strategy stays tainted (grants no independence).",
    "Manifest emitter conforms to the shipped core schema gluerun.orchestration.ctx-rehydrate-manifest.v0 (validated in-test); packet ordering preserves selection order (contradictions-first), per-node sections not per-class deduped, caps/truncation marker match the flat assembler, quarantine composed through the single authority gluerun_ctx_artifact_exclude.",
    "Non-blocking: module-packet-guard.log is empty (0 bytes); worker-packet-validation.log reports 'ok', so no guard failure indicated.",
    "Provenance consistent: packet baseRef bf5e163 equals the parent of HEAD 54d8efc, headSha and branch match live git state; status needs-review; declared out-of-scope items (A/B arm choice, l1-drive.sh wire-in) are documented and correctly deferred."
  ],
  "requiredFixes": [],
  "rationale": "All acceptance criteria are met with evidence. The committed diff is confined to the two owned files with no forbidden-file changes; strict test-first is demonstrated (RED EXIT=1 on absent impl, GREEN EXIT=0), and the gate exits 0 \u2014 both green and regression independently reproduced by the auditor. The renderer preserves selection order, keeps per-node sections without per-class dedup, applies unchanged caps, filters quarantine through the single integrated authority, and emits a manifest conforming to the shipped core schema. OFF-parity, purity, and taint-invariance are asserted by the tests and consistent with a define-only, uncalled module auto-sourced by the ctx-*.sh loader. Provenance (baseRef/headSha/branch) is consistent and no scope expansion, drift, or failing/skipped command was found. Accepted.",
  "findingsStatus": {}
}
