{
  "schema": "gluerun.orchestration.audit-verdict.v0",
  "taskId": "TASK-0001",
  "runId": "RUN-20260710T224233Z-95503",
  "branch": "agent/foundation/TASK-0001-ctx-loader",
  "verdict": "accepted",
  "evidenceReviewed": [
    "packet.json (status=needs-review, baseRef=df4d35d, headSha=efae80e, ownedFiles=[engine/lib.sh, tests/test-ctx-loader.sh], changedFiles identical)",
    "gate-check.json (cmd=bash tests/run.sh, exitCode=0)",
    "worker-evidence/red.log (EXIT=1; 'gluerun_ctx_demo_fn: command not found'; FAIL loads case)",
    "worker-evidence/green.log (EXIT=0; 'ctx-loader tests passed')",
    "worker-evidence/regression.log (24 passed, 0 failed, EXIT=0; includes test-ctx-loader.sh)",
    "git diff df4d35d..efae80e (engine/lib.sh +15, tests/test-ctx-loader.sh +79)",
    "engine/lib.sh loader block L3855-3862 and surrounding GLUERUN_MODULES/GLUERUN_ENGINE_DIR context",
    "tests/test-ctx-loader.sh (4 cases: no-op, load, sorted-once, fail-loud)",
    "schemas/orchestration/audit-verdict.v0.schema.json"
  ],
  "commandsRun": [
    "git diff --name-status df4d35d efae80e",
    "git diff df4d35d efae80e -- engine/lib.sh tests/test-ctx-loader.sh",
    "grep -n GLUERUN_ENGINE_DIR engine/lib.sh; sed -n '3820,3864p' engine/lib.sh",
    "bash tests/test-ctx-loader.sh (independent green: exit 0)",
    "git show df4d35d:engine/lib.sh | grep -c 'Context-evolution loader' (result 0)",
    "git show df4d35d:tests/test-ctx-loader.sh (fatal: not in base \u2014 new file)",
    "ls engine/ctx-*.sh (no matches)",
    "git status --porcelain (clean)"
  ],
  "findings": [
    "Scope compliant: only owned files engine/lib.sh and tests/test-ctx-loader.sh changed; no forbidden file modified; no product engine/ctx-*.sh created (glob has no matches).",
    "Genuine test-first evidence: the loader block is absent at baseRef df4d35d (grep count 0), so red.log's Case-2 failure (gluerun_ctx_demo_fn command not found, EXIT=1) is authentic; green independently reproduced (exit 0).",
    "Gate and regression clean: gate-check.json exit 0, regression 24/24 pass, and the new test is included in tests/run.sh.",
    "Provenance consistent: packet baseRef/headSha/branch match the committed HEAD efae80e; worktree is clean (changes committed).",
    "Loader design is sound and fail-closed: [[ -e ]] guard makes it a no-op when zero ctx-*.sh exist (nullglob-safe), sources in lexical sort order, and aborts non-zero with a diagnostic naming the offending file; uses GLUERUN_ENGINE_DIR (correct, since ctx files live under engine/) and exit 2 on failure, consistent with the adjacent GLUERUN_MODULES block.",
    "Non-blocking observation: the loader relies on the shell glob returning entries in lexical order (default bash behavior); Case 3 asserts '010 020' ordering and passes. No fix required.",
    "Foundation contract honored: nextAction and the block's own comment correctly constrain future context-evolution to new engine/ctx-*.sh files rather than further lib.sh edits."
  ],
  "requiredFixes": [],
  "rationale": "Accepted with evidence. The committed diff (base df4d35d -> head efae80e) is confined to the two owned files with no forbidden path and no product ctx-*.sh file. Test-first is proven, not merely asserted: the loader block does not exist at the base ref, which exactly explains the recorded red failure, and the green/regression logs were independently reproduced (bash tests/test-ctx-loader.sh -> exit 0). The gate ran bash tests/run.sh with exitCode 0 and the full suite is 24/24 passing with no skips. Schema, lifecycle, and provenance fields in the packet are internally consistent and match git. The loader is a correctly-placed, well-documented, fail-closed structural hook that is a verified no-op under the generic engine (byte-identical prior behavior, confirmed by the passing regression suite). No blocking issues found.",
  "findingsStatus": {}
}
