{
  "schema": "gluerun.orchestration.audit-verdict.v0",
  "taskId": "TASK-0037",
  "runId": "RUN-20260711T190626Z-9858",
  "branch": "agent/packets/TASK-0037-assumption-ledger-prompt-sections",
  "verdict": "accepted",
  "evidenceReviewed": [
    "packet.json (status needs-review; changedFiles == ownedFiles; red exit 1 / green exit 0 / regression exit 0)",
    "gate-check.json (exitCode 0) and gate-check.log (both suites green)",
    "worker-evidence/red.log ('gluerun_ctx_assumptions_fix_section: command not found' \u2014 genuine test-first red, function absent)",
    "worker-evidence/green.log ('ctx-assumptions-prompt tests passed')",
    "worker-evidence/regression.log (prompt tests + engine-clean both green)",
    "scope-check.log ('2 changed path(s), all allowed'), secret-scan.log ('clean'), worker-packet-validation.log ('ok')",
    "git show c5258ed diff of engine/ctx-assumptions-prompt.sh (127 LOC, 2 pure helpers + python render) and tests/test-ctx-assumptions-prompt.sh (143 LOC, 6 cases)",
    "l2-active-prompt.md acceptance criteria and last-message.json state packet",
    "sibling engine/ctx-assumptions.sh (A1..An id seed) and engine/ctx-assumptions-transition.sh (assumptionId->violated flip) for schema/lifecycle consistency",
    "engine/lib.sh:3851-3857 ctx-*.sh loader block; schemas/orchestration/audit-verdict.v0.schema.json"
  ],
  "commandsRun": [
    "git rev-parse --abbrev-ref HEAD; git log --oneline -5; git status --porcelain",
    "git diff --name-status 104d80ed914500cb3141e01131fcafffa2337c4d..c5258ed",
    "git show c5258ed -- engine/ctx-assumptions-prompt.sh tests/test-ctx-assumptions-prompt.sh",
    "bash tests/test-ctx-assumptions-prompt.sh  (exit 0, independent re-run)",
    "bash tests/test-engine-clean.sh  (exit 0, independent re-run)",
    "grep -rn 'gluerun_ctx_assumptions_(fix|audit)_section|_prompt_py' engine/ tests/",
    "cat tests/test-engine-clean.sh; grep -n 'GLUERUN_CTX_PACKET|GLUERUN_ROOT' engine/ctx-assumptions-prompt.sh",
    "git rev-parse c5258ed^; git merge-base --is-ancestor 104d80e c5258ed"
  ],
  "findings": [
    "Scope clean: only the two owned files (engine/ctx-assumptions-prompt.sh, tests/test-ctx-assumptions-prompt.sh) were added; no forbidden/out-of-scope file touched; scope-check reports all paths allowed.",
    "Test-first evidence is genuine: red.log fails with 'command not found' (the two helpers are defined ONLY in the new engine file, confirmed by grep), green.log and both my independent re-runs pass; gate exit 0.",
    "Acceptance criteria met: fix section foregrounds 'violated' entries with id+claim then lists non-violated context in id order (Case 1/5); audit section instructs verify + cite the assumptionId and lists all ids in order (Case 2); empty/absent/malformed ledger -> empty string (Case 3); deterministic byte-identical output (Case 4); purity/no-file-writes asserted (Case 6).",
    "Schema/lifecycle/provenance consistent with siblings: 'violated' status and the 'assumptionId' citation field match engine/ctx-assumptions-transition.sh's host-derived flip; A1..An id scheme matches engine/ctx-assumptions.sh seed \u2014 the render closes the fix/audit loop the node's requiredCompletion describes.",
    "OFF byte-identical holds: GLUERUN_CTX_PACKET appears only in a comment (line 7) and is never consulted in code; the helpers are auto-sourced by the ctx-*.sh loader yet called by no engine/CLI/driver path (present-but-uncalled), so GLUERUN_CTX_PACKET=0 behavior is unchanged; engine-clean regression green.",
    "No branch drift: baseRef 104d80e is the direct parent of and an ancestor of HEAD c5258ed; packet headSha matches the committed HEAD.",
    "Non-blocking (documented in nextAction, not a defect): this slice is render-only and not yet wired into real fix/audit prompts behind GLUERUN_CTX_PACKET \u2014 explicitly deferred to a later driver-hook slice per the objective, so it is not hidden scope reduction."
  ],
  "requiredFixes": [],
  "rationale": "All acceptance criteria are satisfied with raw evidence. The change is confined to the two owned files (both new), has authentic red->green test-first logs plus a green engine-clean regression, and the gate exits 0 (independently reproduced). The two helpers are pure string->string transforms (no file I/O, no events, no flag consulted), render deterministic id-ordered sections, foreground 'violated' assumptions for the fix prompt, and direct the auditor to cite the assumptionId \u2014 consistent with the seed/transition schema and lifecycle. No forbidden files, no branch drift, no failing or skipped commands, and the render-only/uncalled nature is intentional and disclosed in nextAction rather than hidden. Accepted."
}
