{
  "schema": "gluerun.orchestration.audit-verdict.v0",
  "taskId": "TASK-0054",
  "runId": "RUN-20260712T040157Z-87358",
  "branch": "agent/routing/TASK-0054-rehydrate-route-wirein",
  "verdict": "accepted",
  "evidenceReviewed": [
    "packet.json (PKT-TASK-0054-rehydrate-route-wirein): schema gluerun.orchestration.state-packet.v0, status needs-review, baseRef efcba39, headSha b47f2cf, ownedFiles==changedFiles==[engine/ctx-route.sh, tests/test-ctx-rehydrate-route.sh]",
    "gate-check.json: cmd 'bash tests/run.sh', exitCode 0",
    "gate-check.log tail: SUMMARY 77 passed, 0 failed",
    "worker-evidence/red.log: FAIL 'ON upgrade: lease refusal -> rehydrate session-lease: expected [rehydrate session-lease], got [fresh session-lease]' (genuine pre-wire red)",
    "worker-evidence/green.log: 7 ok: lines + 'ctx-rehydrate-route tests passed'",
    "worker-evidence/regression.log: 77 passed, 0 failed, EXIT=0",
    "scope-check.log: '2 changed path(s), all allowed'",
    "secret-scan.log: 'secret-scan: clean'",
    "worker-packet-validation.log: ok; module-packet-guard.log empty",
    "git diff efcba39..b47f2cf --name-only: only engine/ctx-route.sh (+44/-3) and tests/test-ctx-rehydrate-route.sh (new, 254 lines)",
    "engine/ctx-route.sh wire-in _gluerun_ctx_route_refuse_resume and its three call sites at the lease/window/diff gate refusals",
    "l2-active-prompt.md acceptance criteria (ON upgrade, OFF-parity REHYDRATE, OFF-parity CTX_ROUTING, independence pin, empty-packet degrade, baseline-fresh, contract/taint)"
  ],
  "commandsRun": [
    "git branch --show-current; git log --oneline -5; git status --porcelain",
    "git diff --stat/--name-only efcba39..b47f2cf",
    "git diff efcba39..b47f2cf -- engine/ctx-route.sh tests/test-ctx-rehydrate-route.sh",
    "cat packet.json gate-check.json red.log green.log regression.log",
    "grep -rn dependency fn definitions in engine/ (gluerun_ctx_rehydrate_sources|_manifest|route_rehydrate_decide|route_strategy_tainted|route_independence_admit)",
    "grep -n ctx- auto-source loop in engine/lib.sh",
    "tail gate-check.log; cat scope-check.log secret-scan.log worker-packet-validation.log"
  ],
  "findings": [
    "File scope compliant: exactly the two owned files changed; scope-check confirms all allowed; no forbidden file touched.",
    "Test-first confirmed: red.log fails at the lease-gate assertion with the exact pre-wire output ('fresh session-lease'); green.log passes all 7 assertion groups covering every acceptance criterion.",
    "Regression + gate green: bash tests/run.sh = 77 passed / 0 failed / EXIT=0; gate-check.json exitCode 0. test-ctx-route.sh and the rest of the ctx-route suite stay green.",
    "Implementation is minimal and in-scope: only the three resume-gate refusals (session-lease/window-pressure/diff-volume) are routed through the new helper; independence pin (fresh tainted) still runs before the gates, baseline-fresh and resume-stands lines unchanged.",
    "OFF-parity preserved: GLUERUN_REHYDRATE!=1 prints byte-identical 'fresh <reason>' with no resolver/manifest work; GLUERUN_CTX_ROUTING!=1 returns the wrapped decider verbatim; rehydrate composition guarded behind GLUERUN_REHYDRATE=1.",
    "Foundation invariants intact: spine keeps one-line/no-event contract, never exits non-zero, and rehydrate remains tainted (gluerun_ctx_route_strategy_tainted rehydrate == 1, asserted in test \u00a77).",
    "Dependency leaves exist and are auto-sourced: gluerun_ctx_rehydrate_sources (ctx-rehydrate-sources.sh), gluerun_ctx_rehydrate_manifest (ctx-rehydrate.sh), gluerun_ctx_route_rehydrate_decide (ctx-route-rehydrate.sh) \u2014 composition order matches the objective.",
    "Provenance consistent: baseRef efcba39 is the parent of headSha b47f2cf (base + single worker commit); no branch drift; packet ownedFiles==changedFiles.",
    "Scope boundary respected: l1-drive.sh manifest-into-context.strategy_selected recording and the packet-injection hook are correctly deferred to later slices per packet.nextAction; not touched here."
  ],
  "requiredFixes": [],
  "rationale": "Accepted with full evidence. The committed diff (efcba39..b47f2cf) modifies only the two owned files; scope-check, secret-scan, and packet validation are clean. Test-first is demonstrated: red.log fails with the exact pre-wire 'fresh session-lease' output and green.log passes all seven acceptance-mapped assertion groups (ON upgrade for lease/window/diff, OFF-parity for both GLUERUN_REHYDRATE and GLUERUN_CTX_ROUTING, independence pin held to 'fresh tainted', empty/absent-run_dir degrade to 'fresh <reason>', baseline-fresh untouched, and the one-line/exit-0/taint contract). The full suite is green (77/0) and the gate exit code is 0. The wire-in correctly guards the resolver/manifest composition behind GLUERUN_REHYDRATE=1, preserves byte-identical OFF behavior, keeps the spine's one-line no-event contract, leaves the independence pin ordering and baseline pass-throughs intact, and defers the out-of-scope l1-drive.sh slices. No blocking or non-blocking defects found."
}
