{
  "schema": "gluerun.orchestration.audit-verdict.v0",
  "taskId": "TASK-0024",
  "runId": "RUN-20260711T093218Z-41209",
  "branch": "agent/plancritic/TASK-0024-l1-plan-node-revise-hook",
  "verdict": "accepted",
  "evidenceReviewed": [
    "packet.json (status needs-review; baseRef e443eb3; headSha 33933fe matches HEAD; changedFiles == ownedFiles)",
    "gate-check.json (cmd 'bash tests/run.sh' exitCode 0) + gate-check.log (45 passed, 0 failed)",
    "worker-evidence/red.log (OFF cases pass, import case FAILs on missing critic marker before hook exists \u2014 valid test-first red)",
    "worker-evidence/green.log (all 4 cases pass after hook)",
    "worker-evidence/regression.log (45 passed, 0 failed)",
    "scope-check.log ('2 changed path(s), all allowed'); secret-scan.log ('clean'); worker-packet-validation.log ('ok')",
    "git diff e443eb3..33933fe: engine/l1-plan-node.sh (M, +28), tests/test-l1-plan-node-revise-hook.sh (A, +254) \u2014 both owned, no forbidden files",
    "engine/l1-plan-node.sh hook body (default-OFF guard GLUERUN_PLAN_CRITIQUE==1, import->planned/exit0/lease active, park->lease failed/plan-failed/exit1)",
    "tests/test-l1-plan-node-revise-hook.sh (hermetic stub planner + stub critic, OFF/OFF=0/import/park cases)",
    "engine/ctx-plan-revise-loop.sh:83 defines gluerun_plan_revise_loop; engine/lib.sh:3857 auto-sources engine/ctx-*.sh so the function is in scope",
    "tests/test-ctx-plan-revision.sh:295-299 sibling case (E) 'present-but-uncalled' literal grep of engine/ for gluerun_plan_revise_loop",
    "l2-active-prompt.md acceptance criteria and execution contract"
  ],
  "commandsRun": [
    "git log --oneline -8; git branch --show-current; git status --short",
    "git diff --stat / --name-status e443eb3..33933fe",
    "git rev-parse HEAD (33933fe921de2b0eb1ef156b8e5b288aa9df1d13) and baseRef",
    "cat packet.json / gate-check.json / gate-check.log / scope-check.log / secret-scan.log / worker-evidence/{red,green,regression}.log",
    "grep -rn gluerun_plan_revise_loop engine/ ; grep sourcing in engine/lib.sh ; grep case (E) in tests/test-ctx-plan-revision.sh",
    "bash tests/test-l1-plan-node-revise-hook.sh  -> RC 0 (4/4 pass, re-run)",
    "bash tests/run.sh  -> RC 0 (45 passed, 0 failed, re-run)"
  ],
  "findings": [
    "File scope clean: only the two owned files changed (engine/l1-plan-node.sh M, tests/test-l1-plan-node-revise-hook.sh A); no forbidden file touched; scope-check and secret-scan clean.",
    "Test-first evidence valid: red.log shows the OFF cases already green with the import case failing precisely on the un-created critic marker (orchestrator not yet wired), green.log shows all four cases passing after the minimal hook \u2014 genuine red->green.",
    "Gate green and independently reproduced: gate-check.json exitCode 0 and my own re-run of both the owned test (RC 0) and the full suite (45 passed, 0 failed) confirm it.",
    "Provenance/lifecycle consistent: packet status needs-review, baseRef e443eb3, headSha 33933fe == committed HEAD, changedFiles == ownedFiles, branch matches; gate cmd is 'bash tests/run.sh'.",
    "Default-OFF byte-identity holds: the entire hook is enclosed in `if [[ \"${GLUERUN_PLAN_CRITIQUE:-0}\" == \"1\" ]]` inside the existing staging-success branch, so with the flag unset/=0 control falls straight through to the original `echo planned:$node; exit 0` \u2014 no new state, tests assert no critic marker / plan-critique.json / plan.critiqued event when OFF.",
    "Routing correct and verified at runtime: import -> planned:<node>/exit 0/lease active; park (incl. loop-error fallback) -> lease set failed + plan-failed:<node> + exit 1; the composed name `${_revise_pfx}loop` resolves to the lib.sh-auto-sourced gluerun_plan_revise_loop (import/park cases assert the critic stub actually ran).",
    "NON-BLOCKING integrity note: the hook intentionally constructs the orchestrator name from a prefix var (`_revise_pfx=gluerun_plan_revise_; \"${_revise_pfx}loop\"`) specifically so tests/test-ctx-plan-revision.sh case (E)'s literal `grep -rl gluerun_plan_revise_loop engine/` stays green. That grep now asserts an invariant ('no engine path invokes the function') that is semantically FALSE \u2014 l1-plan-node.sh does invoke it at runtime. This is fully disclosed (code comment + nextAction) and is forced by TASK-0024's own acceptance criteria, which require adding the caller while keeping the full suite \u2014 including the un-owned sibling test \u2014 green. It is not a scope or evidence violation, but the sibling test now gives misleading structural confidence."
  ],
  "requiredFixes": [],
  "rationale": "Every acceptance criterion is met with reproducible evidence: the hook fires only in the existing staging-success branch under GLUERUN_PLAN_CRITIQUE=1, delegates to the integrated gluerun_plan_revise_loop, and correctly routes import (staged/lease-active/exit 0) vs park (lease failed/plan-failed/exit 1) so unapproved candidates never reach L0; the OFF path is byte-identical (guarded block, verified); strict-test-first red/green/regression logs are honest and I independently reproduced RC 0 on both the owned test and the full 45/45 suite; scope, secret-scan, and packet provenance (headSha == HEAD, changedFiles == ownedFiles) all check out. The one concern \u2014 the name-splitting that keeps the sibling test-ctx-plan-revision.sh case (E) literal grep green while the orchestrator is genuinely now called \u2014 is disclosed, functionally correct, and mandated by this task's constraints (caller must be added, full suite must stay green, the sibling test is out of scope). It does not block acceptance, but I recommend the operator open a follow-up to update test-ctx-plan-revision.sh case (E) so its 'present-but-uncalled' assertion reflects that plan-revision-loop now has its sanctioned call-site; that reconciliation is out of this worker's file scope."
}
