{
  "schema": "gluerun.orchestration.audit-verdict.v0",
  "taskId": "TASK-0040",
  "runId": "RUN-20260711T194943Z-32792",
  "branch": "agent/packets/TASK-0040-assumption-ledger-drive-wirein",
  "verdict": "accepted",
  "evidenceReviewed": [
    "packet.json (status needs-review, baseRef 6fd09cc, headSha 750ca96, ownedFiles=[engine/l1-drive.sh, tests/test-ctx-assumptions-drive.sh])",
    "gate-check.json (cmd 'bash tests/run.sh', exitCode 0)",
    "worker-evidence/red.log (OFF paths PASS, ON path FAIL: fixSection not injected)",
    "worker-evidence/green.log (all 4 scenarios PASS, ALL CTX-ASSUMPTIONS-DRIVE TESTS PASSED)",
    "worker-evidence/regression.log (61 passed, 0 failed incl. test-ctx-assumptions-drive.sh, test-l1-drive-paired-audit-hook.sh, test-l1-drive-critic-recheck.sh)",
    "git diff 6fd09cc..750ca96 (engine/l1-drive.sh +133/-0, tests/test-ctx-assumptions-drive.sh +277/-0, additive only)",
    "engine/l1-drive.sh wire-in sites (assumptions_attempt_open/inject_fix/inject_audit/record_capsule/attempt_close, all guarded by assumptions_ctx_enabled, all || true)",
    "tests/test-ctx-assumptions-drive.sh (hermetic drive; scenarios a-OFF-unset, a-OFF-0, b-ON, c-retry)",
    "engine/ctx-assumptions-assemble.sh:41 and engine/ctx-assumptions-transition.sh:45 (integrated pure bricks the wire-in delegates to)",
    "engine/lib.sh:3857-3863 ctx-*.sh loader (auto-sources the bricks into l1-drive.sh runtime)",
    "git status (clean), git log (single worker commit 750ca96 atop base 6fd09cc)"
  ],
  "commandsRun": [
    "git log --oneline -5; git status --porcelain; git branch --show-current",
    "git diff --stat/--name-status/--numstat 6fd09cc 750ca96",
    "git diff 6fd09cc 750ca96 -- engine/l1-drive.sh",
    "git log --oneline 6fd09cc..750ca96",
    "grep -rn gluerun_ctx_assumptions_assemble/_transition definitions in engine/",
    "grep -n l2-active-prompt.md / auditor-active-prompt.md in engine/l1-drive.sh",
    "grep sourcing chain: lib.sh source lines and ctx-*.sh loader block",
    "sed schemas/orchestration/audit-verdict.v0.schema.json"
  ],
  "findings": [
    "File scope clean: diff touches only the two owned files, purely additive (410 insertions, 0 deletions), one worker commit atop the declared baseRef; no forbidden file modified and no branch drift.",
    "Valid test-first evidence: red.log fails on the ON injection assertion before the wire-in, green.log passes all four scenarios; the new test is included in the green full suite.",
    "Gate passed: gate-check.json exitCode 0 and regression.log reports 61 passed / 0 failed, including the sibling paired-audit and critic-recheck l1-drive hooks, so the additive wire-in causes no regression.",
    "ON path is genuinely exercised: l1-drive.sh sources lib.sh which auto-loads engine/ctx-assumptions-assemble.sh and ctx-assumptions-transition.sh via the ctx-*.sh loader, so the wire-in delegates to the real integrated pure bricks rather than silently fail-closing; green.log confirms fixSection/auditSection injection and the sticky violated carry across attempts.",
    "OFF byte-identical confirmed: test (a) uses cmp -s on both l2 and auditor active prompts (unset and =0) and asserts no sidecar/section/attempt files are written; every wire-in site is gated by assumptions_ctx_enabled and wrapped || true (fail-closed, non-fatal).",
    "Minor (non-blocking): assumptions_attempt_open is invoked as 'assumptions_attempt_open \"$n\"' but the function consumes no positional argument \u2014 harmless dead argument.",
    "Minor (non-blocking): assumptions_inject_fix writes to a hardcoded $run_dir/l2-active-prompt.md rather than taking the path as a parameter like assumptions_inject_audit; correct because prepare_worker_prompt writes exactly that file (engine/l1-drive.sh:378,411), but slightly inconsistent in style."
  ],
  "requiredFixes": [],
  "rationale": "Accepted with evidence. The committed diff (6fd09cc..750ca96) stays entirely within the two owned files, is additive-only with no forbidden-file modification and no branch drift. Test-first is proven: red.log shows the ON injection assertion failing before the wire-in and green.log shows all four scenarios (OFF-unset, OFF-=0, ON-inject, retry sticky-carry) passing. The gate exits 0 and the full regression suite is 61/0 including the sibling l1-drive paired-audit and critic-recheck hooks, so the additive wire-in introduces no regression and does not collide with those hooks. The ON path genuinely delegates to the integrated pure bricks (assemble/transition) auto-loaded via lib.sh's ctx loader, and OFF byte-identical behavior is verified by cmp plus absence-of-artifacts assertions, with all sites guarded and fail-closed/non-fatal. Only two cosmetic, non-blocking observations remain; none warrant a fix. Acceptance criteria met."
}
