{
  "schema": "gluerun.orchestration.audit-verdict.v0",
  "taskId": "TASK-0021",
  "runId": "RUN-20260711T080020Z-20536",
  "branch": "agent/plancritic/TASK-0021-plan-revise-dispositions",
  "verdict": "accepted",
  "evidenceReviewed": [
    "packet.json (status needs-review, baseRef 46abda6, headSha 379ca12 \u2014 matches actual HEAD)",
    "gate-check.json (cmd 'bash tests/run.sh', exitCode 0)",
    "engine/ctx-plan-revise-dispositions.sh (193 lines, new file)",
    "tests/test-ctx-plan-revise-dispositions.sh (252 lines, new file)",
    ".gluerun-evidence/red.log (RED: engine not present, exit=1)",
    ".gluerun-evidence/green.log (GREEN: tests passed, exit=0)",
    ".gluerun-evidence/regression.log (42 passed, 0 failed, exit=0)",
    "engine/lib.sh gluerun_append_event definition (L470) and ctx-*.sh auto-loader block (L3851)"
  ],
  "commandsRun": [
    "git rev-parse --abbrev-ref HEAD / rev-parse HEAD (branch+headSha confirmed, HEAD==379ca12)",
    "git diff --stat/--name-only 46abda6..HEAD (only 2 owned files, +445/-0)",
    "git status --porcelain (working tree clean)",
    "bash tests/test-ctx-plan-revise-dispositions.sh (reproduced GREEN, exit=0)",
    "grep -rn for gluerun_plan_revise_classify/record_dispositions across engine/ and *.sh (no callers outside owned file \u2014 present-but-uncalled confirmed)",
    "grep gluerun_append_event in engine/lib.sh (signature type/message/data matches the impl's 3-arg call)"
  ],
  "findings": [
    "File scope: diff touches only the two owned files (engine/ctx-plan-revise-dispositions.sh, tests/test-ctx-plan-revise-dispositions.sh); no forbidden file modified; changedFiles matches ownedFiles.",
    "Test-first evidence genuine: red.log fails at the test's own `[[ -f $CTX ]]` guard (exit 1, impl absent) before green.log passes (exit 0); independently reproduced GREEN.",
    "Gate passes: gate-check.json exitCode 0; full regression 42 passed / 0 failed including test-ctx-plan-revise-dispositions.sh.",
    "present-but-uncalled invariant holds: no engine path or other script references the new functions; test (f) asserts this and it verifies via grep.",
    "Provenance consistency: gluerun_plan_revise_record_dispositions calls gluerun_append_event with 3 args (type 'plan.revised', message, data) matching lib.sh signature; event type follows the dotted convention (planner.generated, recovery.action); records-only, no lease/runner/candidate mutation, confirmed by sentinel-runner and events-file assertions.",
    "Classifier contract met: pure/read-only, id-sorted TAB output, always exit 0, fail-closed to accepted-but-unaddressed with no fabricated rejected/accepted on missing/unparseable record or batch, deterministic payload \u2014 all asserted and passing.",
    "Minor (non-blocking): record_dispositions interpolates $classified into an unquoted python heredoc; safe because classifier output is constrained to `f-[0-9a-f]{12}\\t<fixed-disposition>` lines with no quotes/backslashes.",
    "No scope expansion or branch drift: baseRef 46abda6 present, headSha 379ca12 matches HEAD, follow-up slices (resume-vs-fresh planner re-invocation, generate-tasks.sh/l1-plan-node.sh driver hooks) explicitly documented as out of scope and node gate correctly left BLOCKED."
  ],
  "requiredFixes": [],
  "rationale": "The committed diff stays strictly within the two owned files and touches no forbidden path. Test-first evidence is authentic (red exit 1 with implementation absent, then green exit 0), independently reproduced, and the full regression suite passes 42/0 with gate exit 0. The brick satisfies the requiredCompletion predicate 'per-finding accepted/rejected-observation dispositions evented' via a pure/read-only classifier and a records-only plan.revised provenance event whose gluerun_append_event call matches lib.sh's signature and naming convention. The present-but-uncalled invariant is verified (no callers outside the owned file), so the engine remains byte-identical in behavior and the node gate stays BLOCKED for the explicitly out-of-scope follow-up slices. No missing tests, no hidden scope expansion, no failing or skipped commands, and no foundation violations were found."
}
