{
  "schema": "gluerun.orchestration.audit-verdict.v0",
  "taskId": "TASK-0084",
  "runId": "RUN-20260712T175155Z-19932",
  "branch": "agent/graph/TASK-0084-graph-sync-entrypoint",
  "verdict": "accepted",
  "evidenceReviewed": [
    ".gluerun-state/runs/RUN-20260712T175155Z-19932/packet.json (state packet: ownedFiles == changedFiles == [engine/ctx-graph-sync.sh, tests/test-ctx-graph-sync.sh]; baseRef 205e763; headSha 5d382d6; status needs-review)",
    ".gluerun-state/runs/RUN-20260712T175155Z-19932/gate-check.json (exitCode 0)",
    ".gluerun-state/runs/RUN-20260712T175155Z-19932/gate-check.log",
    ".gluerun-state/runs/RUN-20260712T175155Z-19932/worker-evidence/red.log (RED: 'impl not present yet ... strict-test-first RED')",
    ".gluerun-state/runs/RUN-20260712T175155Z-19932/worker-evidence/green.log (GREEN: all assertions passed)",
    ".gluerun-state/runs/RUN-20260712T175155Z-19932/worker-evidence/regression.log (sync + engine-clean pass)",
    "git diff --name-status 205e763..5d382d6 (only the two owned files, both status A)",
    "docs/orchestration/tasks/TASK-0084.md (objective, scope, acceptance criteria)",
    "engine/ctx-graph-sync.sh (216 lines: cursor read/write + gluerun_graph_sync)",
    "tests/test-ctx-graph-sync.sh (370 lines; asserts rebuild==sync from-scratch+incremental, cursor, idempotence, schema, split, OFF-parity)",
    "engine/ctx-graph-rebuild.sh, ctx-graph-project.sh, ctx-graph-project-plans.sh, ctx-graph-project-records.sh, ctx-graph-corpus.sh (all referenced mappers/partition/writer/rebuild defined and integrated)",
    "engine/lib.sh:3851-3857 (ctx-*.sh auto-source loop already present; not modified by this task)",
    "tests/test-engine-clean.sh (banned-symbol set; GLUERUN_ env/function namespace is allowed brand)",
    "schemas/orchestration/audit-verdict.v0.schema.json",
    "schemas/context-graph.v0.schema.json (validation target)"
  ],
  "commandsRun": [
    "git branch --show-current; git log --oneline -5",
    "git diff --stat / --name-status 205e763..5d382d6",
    "git status --porcelain (clean); git rev-parse HEAD (5d382d6)",
    "bash tests/test-ctx-graph-sync.sh && bash tests/test-engine-clean.sh (independent GATE re-run -> exit 0)",
    "copied engine+tests+schema to a temp dir with engine/ctx-graph-sync.sh removed and ran the test (independent RED reproduction -> exit 1, fail-closed)",
    "grep for referenced mapper/partition/writer/rebuild function definitions across integrated engine files",
    "grep GLUERUN in engine/ctx-graph-sync.sh; read tests/test-engine-clean.sh banned list"
  ],
  "findings": [
    "Scope: clean. HEAD commit adds exactly the two owned files (engine/ctx-graph-sync.sh, tests/test-ctx-graph-sync.sh), both status A; no forbidden file touched; working tree clean; changedFiles in packet match git.",
    "Test-first: verified. Independently reproduced RED (test exits 1 with 'impl not present yet ... strict-test-first RED' when the impl file is absent) and GREEN (gate exits 0 with impl present). red/green/regression logs are consistent with the committed state.",
    "Gate: bash tests/test-ctx-graph-sync.sh && bash tests/test-engine-clean.sh independently exits 0, matching gate-check.json.",
    "Acceptance coverage: the test exercises every criterion \u2014 rebuild==sync from-scratch (nodes+edges diff), rebuild==sync incremental (append events -> equals fresh rebuild), cursor advance / missing-reads-0 / no-new-events no-regress, idempotence (repeat sync byte-identical), per-line shipped-schema validation, authoritative/claim split (commit+gate-result authoritative else claim), OFF-parity (sourcing writes nothing; sync leaves <stateDir> byte-identical, writes only under <graphDir>), and GLUERUN_CTX_GRAPH_DIR default resolution.",
    "OFF-parity / no scope expansion: ctx-graph-sync.sh defines functions only; no existing engine path invokes them; lib.sh's ctx-*.sh loader is pre-existing and unmodified; the cli/gluerun graph call site is correctly deferred to a later task.",
    "engine-clean: sync file uses only the engine's own GLUERUN_ env/function namespace (allowed); it contains none of the banned project-specific symbols, so test-engine-clean genuinely passes.",
    "Provenance consistency: the events delta is projected from a temp slice and its provenance.sourcePath is normalized back to the canonical <stateDir>/events.ndjson via _gluerun_graph_sync_setpath, and existing corpus is re-fed through gluerun_graph_write_corpus \u2014 the empirical basis for the proven byte-identity to rebuild.",
    "Minor (non-blocking): the docstring/code fail-closes a MALFORMED cursor to 0 (regex guard), but the test only covers the missing/absent-cursor -> 0 path, not the malformed-value path. This defensive branch is untested and is not part of the stated acceptance criteria; no required fix."
  ],
  "requiredFixes": [],
  "rationale": "The committed diff stays strictly within the two owned files and touches no forbidden path (git name-status against baseRef 205e763 confirms two additions only). Strict-test-first is proven independently: I reproduced RED (exit 1, fail-closed 'impl not present yet') by running the test against a copy with the impl removed, and GREEN by re-running the full gate (exit 0), matching the worker's red/green/regression logs and gate-check.json. Every acceptance criterion is backed by an assertion in tests/test-ctx-graph-sync.sh using strong independent oracles \u2014 diff against gluerun_graph_rebuild output for byte-identical rebuild-equals-sync (both from-scratch and incremental), shipped-schema validation of every line, the authoritative/claim split check, cursor advance/no-regress, idempotence on repeat sync, and OFF-parity/no-writes-to-<stateDir>. All referenced rebuild machinery (nine mappers, gluerun_graph_partition, gluerun_graph_write_corpus, gluerun_graph_rebuild) is present and integrated, and the sync file introduces no banned symbols so engine-clean legitimately stays green. The only observation is an untested malformed-cursor defensive branch, which is outside the stated criteria and not a blocker. Evidence is complete and consistent; accepted."
}
