{
  "schema": "gluerun.orchestration.audit-verdict.v0",
  "taskId": "TASK-0064",
  "runId": "RUN-20260712T081709Z-68874",
  "branch": "agent/routing/TASK-0064-rehydrate-authored-triggers",
  "verdict": "accepted",
  "evidenceReviewed": [
    "packet.json (status=needs-review, ownedFiles==changedFiles, baseRef 66d1989, headSha 68f307b)",
    "gate-check.json (cmd: test-ctx-rehydrate-authored-triggers.sh && test-engine-clean.sh, exitCode 0)",
    "worker-evidence/red.log (RED: 'gluerun_ctx_rehydrate_authored_triggers: command not found' -> FAIL case1, EXIT=1)",
    "worker-evidence/green.log (GREEN: 'ctx-rehydrate-authored-triggers tests passed', EXIT=0)",
    "worker-evidence/regression.log (leaf + engine-clean pass, EXIT=0)",
    "git diff 66d1989..68f307b (only the two owned files added, +176 lines)",
    "engine/ctx-rehydrate-authored-triggers.sh (pure function definition, no source-time execution)",
    "tests/test-ctx-rehydrate-authored-triggers.sh (7 cases: full-set, backward-compat implement, optional-args, dedup, determinism/order, purity, OFF-parity guard)",
    "engine/lib.sh ctx-*.sh loader block (lines 3851-3862: glob-sources every ctx-*.sh, fail-closed)",
    "schemas/orchestration/audit-verdict.v0.schema.json"
  ],
  "commandsRun": [
    "git branch --show-current; git log --oneline -5; git status --porcelain",
    "git diff --stat / --name-only 66d1989..68f307b",
    "git diff 66d1989..68f307b (full)",
    "grep -n sourcing block in engine/lib.sh",
    "bash tests/test-ctx-rehydrate-authored-triggers.sh (re-run, EXIT=0)",
    "bash tests/test-engine-clean.sh (re-run, EXIT=0)",
    "grep -rn gluerun_ctx_rehydrate_authored_triggers --include=*.sh (no live call site)"
  ],
  "findings": [
    "File scope compliant: only engine/ctx-rehydrate-authored-triggers.sh and tests/test-ctx-rehydrate-authored-triggers.sh changed; no forbidden file touched.",
    "Genuine test-first: red.log fails with function-not-found while the test already exists; green.log passes after the leaf lands.",
    "Gate exit 0; independently re-ran the leaf test and engine-clean regression \u2014 both pass (EXIT=0).",
    "OFF-parity confirmed: gluerun_ctx_rehydrate_authored_triggers is defined only in the leaf and never invoked by any engine/CLI/driver path (grep shows only the leaf definition and the test's own subshell/guard). Leaf is pure function-definition, so sourcing via the ctx-*.sh glob is inert and behavior stays byte-identical.",
    "Purity/determinism verified by tests: no empty tokens for absent optional args, repeated dimensions dedup to one token, fixed role<step<node<task order, deterministic byte-identical reruns, and no disk writes into the sentinel dir.",
    "No branch drift: headSha 68f307b == HEAD and its parent == baseRef 66d1989; single worker commit atop base.",
    "No schema/lifecycle/provenance inconsistencies; packet status needs-review is correct and evidence refs resolve."
  ],
  "requiredFixes": [],
  "rationale": "Accepted with evidence. The committed diff (base 66d1989 -> head 68f307b) adds only the two owned files. Test-first is demonstrated: red.log is a genuine RED (function absent -> 'command not found' -> FAIL case1, EXIT=1) and green.log/regression.log are GREEN (EXIT=0); I independently re-ran both the leaf test and test-engine-clean and both passed. The gate (gate-check.json) exited 0. The deliverable is a pure, read-only, deterministic trigger-set builder that is present-but-uncalled: it is auto-sourced by lib.sh's ctx-*.sh loader but has no live call site, and being a bare function definition it preserves byte-identical OFF-parity (GLUERUN_CTX_MANIFEST default 0 still gates the feature). This is the explicitly-optional refinement slice and does not gate the rehydrate-path node's requiredCompletion; the follow-up wire-in is documented in the packet nextAction. No file-scope, test, provenance, drift, or foundation violations were found."
}
