{
  "schema": "gluerun.orchestration.audit-verdict.v0",
  "taskId": "TASK-0063",
  "runId": "RUN-20260712T073800Z-74265",
  "branch": "agent/routing/TASK-0063-rehydrate-authored-manifest-record",
  "verdict": "accepted",
  "evidenceReviewed": [
    "packet.json (status needs-review, baseRef 6447e29, headSha 041cf2c, ownedFiles == changedFiles == [engine/ctx-rehydrate-event.sh, tests/test-ctx-rehydrate-authored-event.sh])",
    "gate-check.json (cmd 'bash tests/run.sh', exitCode 0)",
    "gate-check.log (SUMMARY: 86 passed, 0 failed)",
    "worker-evidence/red.log (case1 assertion 'manifest.authored missing when armed+configured' fails pre-impl)",
    "worker-evidence/green.log ('ctx-rehydrate-authored-event tests passed')",
    "worker-evidence/regression.log (86 passed, 0 failed)",
    "scope-check.log (2 changed paths, all allowed)",
    "secret-scan.log (clean)",
    "worker-packet-validation.log (ok), module-packet-guard.log (empty/clean)",
    "l2-active-prompt.md (objective + acceptance criteria)",
    "git diff 6447e29..041cf2c (M engine/ctx-rehydrate-event.sh +30/-2, A tests/test-ctx-rehydrate-authored-event.sh +198)",
    "engine/ctx-rehydrate-authored-config.sh:76 (delegation target gluerun_ctx_rehydrate_authored_config_manifest defined in integrated, non-owned file)"
  ],
  "commandsRun": [
    "git rev-parse --abbrev-ref HEAD; git log -1 --format=%H %s (branch agent/routing/TASK-0063-...; HEAD 041cf2c)",
    "git log -1 --format=%P HEAD (parent == baseRef 6447e29 == integration tip after TASK-0062 merge; no drift)",
    "git diff --name-status 6447e29 HEAD (only 2 owned files; no forbidden file touched)",
    "grep -rn gluerun_ctx_rehydrate_authored_config_manifest engine/ (defined in ctx-rehydrate-authored-config.sh; only CALLED, not inlined, in owned file)",
    "bash tests/test-ctx-rehydrate-authored-event.sh (independent green, exit 0)",
    "restored baseRef engine/ctx-rehydrate-event.sh + reran target test (independent RED: fails at case1 exactly as red.log, exit 1; file restored, working tree net-zero)",
    "bash tests/run.sh (independent full suite: 86 passed, 0 failed, exit 0)"
  ],
  "findings": [
    "Scope compliant: diff baseRef(6447e29)..HEAD(041cf2c) touches only the two owned files; no forbidden file modified; scope-check + secret-scan clean.",
    "Test-first evidence genuine: red.log shows a real assertion failure (manifest.authored missing) that I independently reproduced by reverting the engine file; green independently confirmed.",
    "Implementation delegates to gluerun_ctx_rehydrate_authored_config_manifest (defined in integrated engine/ctx-rehydrate-authored-config.sh) \u2014 no config/selection/render logic inlined into the owned file, satisfying minimal-delegation.",
    "Consistency invariant satisfied: builder passes the SAME `implement` trigger TASK-0062 injects with; test case2 asserts recorded authored == config-gate delegate output.",
    "Provenance/schema correct: authored entries merged under a distinguishable manifest.authored key, additive to durable manifest.sources (case3 unchanged), each carrying class=authored-knowledge and authoritative=false (case4 no authoritative:true).",
    "OFF-parity holds: gate unset AND gate=0 both yield byte-identical durable-only payload with no `authored` key (case5); armed-but-unconfigured is fail-soft (case7); malformed authored blob skipped rather than recorded as {raw:...}.",
    "Purity preserved: builder mutates nothing on disk and appends no events (case8); output deterministic (case6); merged data is a single valid JSON object.",
    "Regression green independently and via gate: 86 passed / 0 failed, gate-check exitCode 0.",
    "Packet well-formed: status needs-review, no out-of-schema top-level fields, headSha matches committed HEAD; L1-committed flow (worker left uncommitted per contract) is expected."
  ],
  "requiredFixes": [],
  "rationale": "All acceptance criteria are met with independently reproduced evidence. The change is strictly within the two owned files and touches no forbidden file (verified against baseRef 6447e29, which is the integration tip and HEAD's parent \u2014 no branch drift). Test-first is proven: I restored the baseRef engine file and reran the new test, reproducing the exact red assertion in red.log, then confirmed green on the delivered file. The implementation records the config-gated authored-knowledge manifest under a distinguishable manifest.authored key using the same `implement` trigger as TASK-0062 injection, with entries carrying class=authored-knowledge/authoritative=false, durable manifest.sources unchanged, byte-identical OFF-parity, fail-soft handling, determinism, and read-only purity \u2014 all asserted by the 8-case test and independently re-run green. The full regression suite passes independently (86/0) and the gate exit code is 0. Merge delegates to the integrated config gate without inlining config/render logic. No forbidden files, no hidden scope expansion, no failing/skipped commands, no undocumented risk. Accepted with evidence."
}
