{
  "schema": "gluerun.orchestration.audit-verdict.v0",
  "taskId": "TASK-0069",
  "runId": "RUN-20260712T115311Z-12719",
  "branch": "agent/routing/TASK-0069-rehydrate-e2e-guard",
  "verdict": "accepted",
  "evidenceReviewed": [
    "packet.json (PKT-TASK-0069-20260712T115311Z; status needs-review, baseRef cecbb9c, headSha 6bba741, ownedFiles/changedFiles = tests/test-ctx-rehydrate-e2e.sh only)",
    "gate-check.json (cmd: test-ctx-rehydrate-e2e.sh && test-engine-clean.sh; exitCode 0)",
    "gate-check.log (all walks PASS + engine-clean PASS)",
    "worker-evidence/red.log (exit 1; drop critique-record fails full-set assertion A)",
    "worker-evidence/green.log (exit 0; A-F all PASS)",
    "worker-evidence/regression.log (exit 0; e2e + engine-clean)",
    "scope-check.log (1 changed path, all allowed)",
    "secret-scan.log (clean)",
    "worker-packet-validation.log (ok)",
    "last-message.json (worker packet, headSha uncommitted as expected pre-commit)",
    "l2-active-prompt.md (objective + 7 acceptance criteria)",
    "git diff cecbb9c..6bba741 (full 499-line test file; no engine file modified; sources lib.sh read-only, operates in mktemp sandbox)",
    "schemas/orchestration/audit-verdict.v0.schema.json"
  ],
  "commandsRun": [
    "git log --oneline -5 / git branch --show-current / git status --porcelain",
    "git diff --stat + full diff cecbb9c..6bba741",
    "git diff --name-only cecbb9c..6bba741 (=> tests/test-ctx-rehydrate-e2e.sh only)",
    "git merge-base --is-ancestor cecbb9c 6bba741 (=> ancestor ok)",
    "git rev-parse HEAD (=> 6bba7418e6f65cc413c98767a15a751c05a209b3)",
    "GLUERUN_E2E_DROP_CLASS=critique-record bash tests/test-ctx-rehydrate-e2e.sh (=> exit 1, red reproduced)",
    "bash tests/test-ctx-rehydrate-e2e.sh (=> exit 0, green reproduced)",
    "bash tests/test-ctx-rehydrate-e2e.sh && bash tests/test-engine-clean.sh (=> exit 0, regression reproduced)"
  ],
  "findings": [
    "Scope clean: exactly one owned file (tests/test-ctx-rehydrate-e2e.sh) added; no forbidden/engine/schema file modified; scope-check and engine-clean both confirm.",
    "Genuine (non-tautology) guard confirmed independently: the drop-critique-record run fails at assertion (A) because the injected id set is pinned to the fixed 7-class FULL_CLASSES list rather than the resolver output; normal run is green.",
    "All acceptance walks present and passing through the real l1-drive.sh driver: (A) all-classes rank-ordered packet + per-section cap + verbatim bytes, (B) manifest.sources==injected ids each with sha256, (C) single-authority quarantine exclusion, (D) byte determinism, (E) OFF-parity fresh w/ no manifest, (F) rehydrate refused-tainted at final-audit/paired-audit under any knobs.",
    "Lineage sound: baseRef cecbb9c is a direct ancestor of committed HEAD 6bba741; worktree clean; packet headSha matches HEAD (last-message 'uncommitted' is expected since L1 commits).",
    "Provenance documented: nextAction explains why critique-record is the canonical drop target (the one durable class l1-drive.sh does not itself persist), correcting the prior attempt's driver-recreated class that stayed green; no undocumented risk.",
    "Gate exit 0, secret-scan clean, worker-packet-validation ok."
  ],
  "requiredFixes": [],
  "rationale": "Accepted with evidence. The committed diff stays strictly within the single owned file tests/test-ctx-rehydrate-e2e.sh and modifies no engine, schema, or other forbidden file (verified via git diff --name-only and scope-check.log). Test-first red/green/regression evidence is present and was independently reproduced: red exits 1 exactly on the pinned full-set assertion when critique-record is dropped (proving the guard bites and is non-tautological), green exits 0 with all composed walks A-F passing through the real driver, and the regression gate (e2e + engine-clean) exits 0. gate-check.json records exitCode 0. Every acceptance criterion \u2014 all-classes rank-ordered packet, manifest completeness/sha256/injected<->recorded consistency, quarantine exclusion via the single gluerun_ctx_artifact_exclude authority, byte determinism, OFF-parity fresh, and rehydrate-tainted independence-unreachability \u2014 is asserted in one deterministic walk and verified green. No hidden scope expansion, no branch drift (base is ancestor of head, tree clean), no failing or skipped commands, and no glueRun-go foundation violation (engine/schemas remain GLUERUN-symbol-free). No fixes required.",
  "findingsStatus": {}
}
