{
  "schema": "gluerun.orchestration.audit-verdict.v0",
  "taskId": "TASK-0092",
  "runId": "RUN-20260712T201113Z-58836",
  "branch": "agent/graph/TASK-0092-graph-project-context",
  "verdict": "accepted",
  "evidenceReviewed": [
    "packet.json (status needs-review; ownedFiles == changedFiles; headSha 48ad47e; baseRef dbdb697)",
    "gate-check.json (exitCode 0; cmd runs owned test + test-engine-clean.sh)",
    "gate-check.log (owned test + engine-clean pass)",
    "worker-evidence/red.log (strict-test-first RED: impl file absent \u2192 fail-closed at test line 42)",
    "worker-evidence/green.log (all assertions passed)",
    "worker-evidence/regression.log (owned test + engine-clean green)",
    "engine/ctx-graph-project-context.sh (150 lines; assumption + capsule mappers, new functions only)",
    "tests/test-ctx-graph-project-context.sh (347 lines; schema-validated, idempotence, identity, OFF-parity, no-writes)",
    "engine/ctx-graph.sh (emit_node evidenceClass fail-closed: only commit|gate-result authoritative)",
    "engine/ctx-graph-project.sh (gluerun_graph_identity present)",
    "engine/ctx-graph-corpus.sh (corpus writer present)",
    "engine/lib.sh ctx-loader block (auto-sources engine/ctx-*.sh)",
    "tests/test-engine-clean.sh (banned-symbol scope check body)",
    "schemas/orchestration/audit-verdict.v0.schema.json"
  ],
  "commandsRun": [
    "git branch --show-current",
    "git log --oneline -5",
    "git show --stat --oneline HEAD",
    "git diff --stat dbdb697..HEAD",
    "git diff --name-status dbdb697..HEAD",
    "git status --porcelain",
    "bash tests/test-ctx-graph-project-context.sh (exit 0)",
    "bash tests/test-engine-clean.sh (exit 0)",
    "bash tests/test-ctx-graph.sh (exit 0)",
    "bash tests/test-ctx-graph-project-records.sh (exit 0)",
    "grep for gluerun_graph_identity/node_id/emit_node dependency definitions",
    "cat packet.json / gate-check.json / gate-check.log / worker-evidence logs"
  ],
  "findings": [
    "File scope compliant: only the two owned files added (both status A), no forbidden file modified, working tree clean.",
    "Genuine test-first evidence: RED failed at the impl-absent guard (line 42), GREEN passes; independently reproduced exit 0 for the owned test and engine-clean.",
    "Gate exit 0; packet headSha 48ad47e equals HEAD and baseRef dbdb697 is the single-commit parent \u2014 no branch drift.",
    "Schema/lifecycle/provenance consistent: assumption+capsule nodes mint as claim via fail-closed emit_node, carry sourcePath + sha256:<64hex>, and every emitted line validates against the shipped context-graph.v0 schema.",
    "OFF-parity preserved: new functions only, unwired into existing engine paths; sourcing writes no filesystem artifacts; mappers are pure stdout.",
    "No foundation violation: engine-clean passes; gluerun_ symbols are the sanctioned engine convention and not in the banned list.",
    "No hidden scope expansion: follow-up wiring (rebuild integration, derived_from edges, extending test-ctx-graph.sh) is explicitly deferred in nextAction, and adjacent suites test-ctx-graph.sh / test-ctx-graph-project-records.sh remain green under the auto-sourced file."
  ],
  "requiredFixes": [],
  "rationale": "All acceptance criteria are met with reproduced evidence. The committed diff is confined to the two owned files (both newly added, no forbidden files, clean tree). Test-first is demonstrated by a legitimate fail-closed RED (impl absent) followed by a passing GREEN, and I independently reproduced GREEN plus the engine-clean regression and both adjacent graph suites at exit 0. The mappers correctly compose the integrated identity/emitter primitives, honor the fail-closed claim evidence class, emit schema-valid provenance-bearing JSONL, maintain OFF-parity/no-writes, and mint no edges. The gate is exit 0, headSha matches HEAD, and the branch tracks its baseRef with no drift. Deferred follow-up work is documented, not silently omitted. Accepted."
}
