{
  "schema": "gluerun.orchestration.audit-verdict.v0",
  "taskId": "TASK-0098",
  "runId": "RUN-20260712T222149Z-27519",
  "branch": "agent/eval/TASK-0098-experiment-render-result",
  "verdict": "accepted",
  "evidenceReviewed": [
    "packet.json (status needs-review; headSha 008ea56 == branch HEAD; baseRef eb212f0 == worker-commit parent; ownedFiles == changedFiles)",
    "gate-check.json (cmd: test-ctx-experiment-render-delta.sh && test-engine-clean.sh; exitCode 0)",
    "worker-evidence/red.log (FAIL: tool not present yet \u2014 genuine red)",
    "worker-evidence/green.log (delta/armaudit/order/fail-safe ok; tests passed)",
    "worker-evidence/regression.log (owned tests + engine-clean pass)",
    "scope-check.log (2 changed paths, all allowed)",
    "secret-scan.log (clean)",
    "worker-packet-validation.log (ok)",
    "git show 008ea56 --name-status (A engine/ctx-experiment-render-delta.sh, A tests/test-ctx-experiment-render-delta.sh only)",
    "engine/ctx-experiment-render-delta.sh (178 lines; STDOUT-only, verbatim delta+armaudit renderers, fail-safe entry delegating to existing composers)",
    "tests/test-ctx-experiment-render-delta.sh (386 lines; behavioral cell cross-checks, determinism, threaded+env delegation, fail-safe zero tables, read-only tree/sibling fingerprints)",
    "engine/ctx-experiment-delta.sh, ctx-experiment-armaudit.sh, ctx-experiment-armstate.sh (delegated composer/emitter functions exist)"
  ],
  "commandsRun": [
    "git branch --show-current; git log -1 --oneline; git status --porcelain",
    "git show --stat --name-status 008ea56; git log -1 --format='%H %P' 008ea56",
    "bash tests/test-ctx-experiment-render-delta.sh (exit 0)",
    "bash tests/test-engine-clean.sh (exit 0)",
    "grep -rn for delegated composer definitions and for external callers of the new render functions",
    "git rev-parse HEAD~1 (== packet baseRef eb212f0)"
  ],
  "findings": [
    "File scope clean: worker commit adds only the two owned files; no forbidden file modified; scope-check reports 2 allowed paths.",
    "Test-first honored: red.log fails on absent tool via the [[ -f TOOL ]] gate; green.log passes; green + regression reproduced independently (both exit 0).",
    "Gate exit 0 (gate-check.json) covering owned tests plus engine-clean regression.",
    "No branch drift: single worker commit atop baseRef eb212f0; worktree clean; headSha matches packet.",
    "No hidden scope expansion: new functions have no external callers \u2014 present-but-uncalled OFF-parity, corroborated by engine-clean pass and the test's sibling-file byte-hash assertions.",
    "Provenance/consistency intact: renderer formats schema-versioned delta and armaudit artifacts verbatim (no recompute/reclassify), delegates to existing gluerun_ctx_experiment_delta_json / _armaudit_json, and is read-only/STDOUT-only.",
    "Documented (not a defect): node completion still requires the operator to run the paired-audited A/B experiment and record per-knob defaults in docs/orchestration/decisions.md, per packet nextAction."
  ],
  "requiredFixes": [],
  "rationale": "Accepted with evidence. The committed worker diff (008ea56) is confined to the two owned files with no forbidden-file changes (git name-status + scope-check.log). Test-first is demonstrated: red.log fails because the tool is absent, green.log passes, and I independently reproduced both the owned test and the engine-clean regression at exit 0, matching gate-check.json (exit 0). The renderer is read-only/STDOUT-only, ships no new metric, renders the delta and armaudit artifacts verbatim, delegates to existing composers that are confirmed present, and is present-but-uncalled (no external callers; engine-clean passes; read-only tree/sibling fingerprint tests hold) \u2014 satisfying OFF-parity and evidence-invariance foundations. No branch drift (one commit on baseRef eb212f0, worktree clean, headSha matches packet), no missing tests, no skipped/failing commands, secret-scan clean. Acceptance criteria for TASK-0098 (markdown rendering of treatment-effect and arm-integrity tables with fail-safe zero output) are met.",
  "findingsStatus": {}
}
