{
  "schema": "gluerun.orchestration.audit-verdict.v0",
  "taskId": "TASK-0004",
  "runId": "RUN-20260711T001014Z-75963",
  "branch": "agent/foundation/TASK-0004-ctx-ab-arm-assign",
  "verdict": "accepted",
  "evidenceReviewed": [
    "packet.json (PKT-TASK-0004-RUN-20260711T001014Z-75963): status=needs-review, baseRef=c755967, headSha=8881207, ownedFiles==changedFiles==[engine/ctx-ab.sh, tests/test-ctx-ab.sh]",
    "gate-check.json: cmd 'bash tests/run.sh' exitCode 0 at 2026-07-11T00:20:12Z",
    "worker-evidence/red.log: 'FAIL: engine not present yet: .../engine/ctx-ab.sh' (matches test line 39 guard; RED exit 1)",
    "worker-evidence/green.log: 'event-shape-ok' + 'ctx-ab tests passed' (GREEN exit 0)",
    "worker-evidence/regression.log: 26 passed, 0 failed incl test-ctx-ab.sh + test-engine-clean.sh",
    "engine/ctx-ab.sh (committed, 56 lines): new functions gluerun_ctx_ab_arm_for (pure) + gluerun_ctx_ab_assign (records ctx.arm_assigned only when GLUERUN_CTX_AB=1)",
    "tests/test-ctx-ab.sh (committed, 171 lines): covers OFF unset/=0 no-event+log-unchanged, determinism repeated+cross-process, distribution both-arms, ON one-event-per-assign with taskId/arm shape",
    "engine/lib.sh (forbidden, unmodified): gluerun_append_event <type> <message> <data> at L470 matches ctx-ab call; ctx-loader auto-sources engine/ctx-*.sh at L3851",
    "git diff c755967..8881207: A engine/ctx-ab.sh (56/0), A tests/test-ctx-ab.sh (171/0)"
  ],
  "commandsRun": [
    "git rev-parse --abbrev-ref HEAD / HEAD -> agent/foundation/TASK-0004-ctx-ab-arm-assign @ 8881207",
    "git diff --name-status c755967..8881207 -> only A engine/ctx-ab.sh, A tests/test-ctx-ab.sh",
    "git diff --name-only c755967..8881207 -- engine/lib.sh -> empty (lib.sh untouched)",
    "git merge-base --is-ancestor c755967 8881207 -> YES (no branch drift; single commit)",
    "grep gluerun_append_event()/ctx-loader in engine/lib.sh -> signature + auto-source glob confirmed",
    "bash tests/test-ctx-ab.sh -> exit 0 (independently reproduced GREEN)",
    "bash tests/run.sh -> SUMMARY: 26 passed, 0 failed, exit 0 (independently reproduced regression)",
    "grep -rn gluerun_ctx_ab_arm_for|gluerun_ctx_ab_assign (excl owned files) -> no external callers"
  ],
  "findings": [
    "File scope: COMPLIANT \u2014 only owned files engine/ctx-ab.sh and tests/test-ctx-ab.sh added; no forbidden file touched; engine/lib.sh byte-unchanged in the diff.",
    "Test-first: SATISFIED \u2014 red.log failure message is exactly the test's file-presence guard (line 39), packet records RED exit 1 -> GREEN exit 0; GREEN independently reproduced (exit 0).",
    "Gate: PASS \u2014 gate-check.json exit 0; full regression independently re-run at 26 passed / 0 failed incl test-engine-clean.sh.",
    "Consistency: gluerun_append_event(type,message,data) in lib.sh matches ctx-ab.sh's call; emitted event {ts,type,message,data:{taskId,arm}} matches the test's grep + python shape assertions.",
    "Provenance/lifecycle: packet baseRef c755967 is a verified ancestor of headSha 8881207; branch and shas match HEAD; single commit; status needs-review \u2014 no branch drift.",
    "Foundation discipline: knob GLUERUN_CTX_AB default-OFF (OFF emits no event, log shasum unchanged); new-functions-only, auto-sourced via lib.sh ctx-*.sh glob but invoked by no engine path \u2014 present-but-uncalled confirmed (grep found no external callers), consistent with byte-identical-engine claim.",
    "No hidden scope expansion, no skipped/failing commands, no missing coverage for the assign/record behavior (OFF, determinism, cross-process, distribution, ON all asserted)."
  ],
  "requiredFixes": [],
  "rationale": "TASK-0004 stays entirely within its owned files (engine/ctx-ab.sh, tests/test-ctx-ab.sh); the forbidden engine/lib.sh and all out-of-scope files are unmodified. Test-first evidence is coherent (RED failure is the exact file-presence guard; GREEN then passes) and I independently reproduced GREEN (exit 0) and the full regression suite (26 passed, 0 failed, exit 0) on the committed HEAD 8881207. The gate exited 0. Cross-file consistency holds: the new functions call lib.sh's gluerun_append_event with the correct signature, produce events whose shape the test verifies, honor the default-OFF GLUERUN_CTX_AB knob, and are auto-sourced yet invoked by no engine path (no external callers found), preserving byte-identical engine behavior. Base c755967 is an ancestor of HEAD with a single commit, so there is no branch drift. Acceptance criteria are met with reproduced evidence and there are no open findings; accepted."
}
