{
  "schema": "gluerun.orchestration.audit-verdict.v0",
  "taskId": "TASK-0075",
  "runId": "RUN-20260712T153044Z-38302",
  "branch": "agent/graph/TASK-0075-graph-corpus-assembler",
  "verdict": "accepted",
  "evidenceReviewed": [
    "packet.json (status=needs-review, ownedFiles + changedFiles both = [engine/ctx-graph-corpus.sh, tests/test-ctx-graph-corpus.sh], baseRef 7872598, headSha 8415951)",
    "gate-check.json (exitCode 0)",
    "gate-check.log (both assertions passed)",
    "worker-evidence/red.log (FAIL: impl not present \u2014 strict-test-first RED)",
    "worker-evidence/green.log (all assertions passed)",
    "worker-evidence/regression.log (corpus + engine-clean pass)",
    "git diff HEAD~1..HEAD --name-status (A engine/ctx-graph-corpus.sh, A tests/test-ctx-graph-corpus.sh \u2014 no forbidden file touched)",
    "engine/ctx-graph-corpus.sh (defines gluerun_graph_canonicalize + gluerun_graph_write_corpus; functions-only, no top-level invocation; writer scoped to <graphdir>)",
    "tests/test-ctx-graph-corpus.sh (covers dedup, id-sort, permutation-independence, verbatim preservation, writer create, idempotence, delete-rebuild, stale-line clearing, default GLUERUN_CTX_GRAPH_DIR, <graphdir> isolation, OFF-parity no-writes)",
    "engine/lib.sh ctx-*.sh auto-source loader (source-order safe: corpus defines-only, no source-time dependency on ctx-graph.sh)",
    "tests/test-engine-clean.sh (bans project-specific symbols only; gluerun brand allowed)",
    "engine/ctx-graph.sh + schemas/context-graph.v0.schema.json (referenced primitives/schema exist)"
  ],
  "commandsRun": [
    "git log --oneline -8; git branch --show-current; git status --short",
    "git diff --stat HEAD~1..HEAD; git diff --name-status HEAD~1..HEAD",
    "bash tests/test-ctx-graph-corpus.sh (exit 0 \u2014 all assertions passed)",
    "bash tests/test-engine-clean.sh (exit 0 \u2014 engine/schemas clean)",
    "bash tests/test-ctx-graph.sh (exit 0); bash tests/test-ctx-loader.sh (exit 0)",
    "RED reproduction: rm engine/ctx-graph-corpus.sh; bash tests/test-ctx-graph-corpus.sh (exit 1, RED); restored file; git status clean"
  ],
  "findings": [
    "File scope: clean \u2014 only the two owned files added; no forbidden path modified; working tree clean after independent RED reproduction/restore.",
    "Test-first: verified \u2014 RED fails closed when impl absent (exit 1, independently reproduced), GREEN passes with impl present (independently exit 0); packet phases match logs.",
    "Gate: gate-check.json exitCode 0; regression (corpus && engine-clean) exit 0.",
    "Provenance/schema: writer canonicalizes real gluerun_graph_emit_node/emit_edge output and every written line re-validates against the shipped context-graph.v0 schema; sibling test-ctx-graph.sh and test-ctx-loader.sh remain green with the auto-sourced file present.",
    "OFF-parity: file defines functions only; no existing engine path invokes them and sourcing writes no filesystem artifact (pinned by before/after snapshot) \u2014 engine byte-identical when GLUERUN_CTX_GRAPH unset.",
    "engine-clean non-issue: gluerun_graph_*/GLUERUN_CTX_GRAPH is the engine's own permitted namespace, not a banned project-specific symbol; test passes.",
    "No branch drift: headSha 8415951 sits directly atop baseRef 7872598 (TASK-0074 integration merge); no unrelated commits.",
    "Note (not a defect): canonicalize collapses duplicate-id lines to the lexicographically smallest full line \u2014 documented, deterministic dedup-by-id behavior; source-walk/merge semantics are explicitly deferred to follow-on graph-projector tasks."
  ],
  "requiredFixes": [],
  "rationale": "Committed diff is confined to the two owned files with zero forbidden-file changes. Strict-test-first evidence is genuine and independently reproduced (RED exit 1 without impl, GREEN exit 0 with impl), the gate exits 0, and the regression plus both sibling context tests stay green. The implementation is a functions-only, OFF-parity keystone whose writer is <graphdir>-scoped and whose output round-trips through the shipped schema, matching the acceptance criteria (deterministic, idempotent, loss-free, byte-identical corpus). No scope expansion, drift, or failing/skipped commands. Accepted with evidence."
}
